<?xml version="1.0" encoding="utf-8" ?>
<SA-POP:taskMap
  xmlns:SA-POP="http://www.vanderbilt.edu/SA-POP"
  xmlns:xsi="http://www.w3.org/2001/XMLSchema-instance"
  xsi:schemaLocation="http://www.vanderbilt.edu/SA-POP Task_Map.xsd"
  xmlns="http://www.vanderbilt.edu/SA-POP">

  <taskImpl>
    <implID>SIGINT_CALL</implID>
    <param>
      <paramID>test_param1</paramID>
      <kind>test_param_kind1</kind>
      <value>test_param_value1</value>
    </param>
  </taskImpl>
  <taskImpl>
    <implID>CAOC_COORD</implID>
    <param>
      <paramID>test_param1</paramID>
      <kind>test_param_kind1</kind>
      <value>test_param_value1</value>
    </param>
  </taskImpl>
  <taskImpl>
    <implID>UAV_LOCATE</implID>
    <param>
      <paramID>test_param1</paramID>
      <kind>test_param_kind1</kind>
      <value>test_param_value1</value>
    </param>
  </taskImpl>
  <taskImpl>
    <implID>UAV_LOCK</implID>
    <param>
      <paramID>test_param1</paramID>
      <kind>test_param_kind1</kind>
      <value>test_param_value1</value>
    </param>
  </taskImpl>
  <taskImpl>
    <implID>UAV_FIND_NEIGH</implID>
    <param>
      <paramID>test_param1</paramID>
      <kind>test_param_kind1</kind>
      <value>test_param_value1</value>
    </param>
  </taskImpl>
  <taskImpl>
    <implID>UAV_EXAMINE</implID>
    <param>
      <paramID>test_param1</paramID>
      <kind>test_param_kind1</kind>
      <value>test_param_value1</value>
    </param>
  </taskImpl>
  <taskImpl>
    <implID>UAV_ARMED</implID>
    <param>
      <paramID>test_param1</paramID>
      <kind>test_param_kind1</kind>
      <value>test_param_value1</value>
    </param>
  </taskImpl>
  <taskImpl>
    <implID>UAV_FIRE</implID>
    <param>
      <paramID>test_param1</paramID>
      <kind>test_param_kind1</kind>
      <value>test_param_value1</value>
    </param>
  </taskImpl>
  <taskImpl>
    <implID>UAV_ASSESS</implID>
    <param>
      <paramID>test_param1</paramID>
      <kind>test_param_kind1</kind>
      <value>test_param_value1</value>
    </param>
  </taskImpl>
  <taskImpl>
    <implID>CAOC_APPROVAL</implID>
    <param>
      <paramID>test_param1</paramID>
      <kind>test_param_kind1</kind>
      <value>test_param_value1</value>
    </param>
  </taskImpl>
  <taskImpl>
    <implID>GROUND_PREPARE</implID>
    <param>
      <paramID>test_param1</paramID>
      <kind>test_param_kind1</kind>
      <value>test_param_value1</value>
    </param>
  </taskImpl>
  <taskImpl>
    <implID>CAOC_SET</implID>
    <param>
      <paramID>test_param1</paramID>
      <kind>test_param_kind1</kind>
      <value>test_param_value1</value>
    </param>
  </taskImpl>
  <taskImpl>
    <implID>GROUND_SEIZE</implID>
    <param>
      <paramID>test_param1</paramID>
      <kind>test_param_kind1</kind>
      <value>test_param_value1</value>
    </param>
  </taskImpl>
    
    
  <resource>
    <resourceID>Vehicles</resourceID>
    <kind>DISCRETE</kind>
    <capacity>2</capacity>
  </resource>
  <resource>
    <resourceID>Troops</resourceID>
    <kind>DISCRETE</kind>
    <capacity>1</capacity>
  </resource>
  <resource>
    <resourceID>Intel</resourceID>
    <kind>DISCRETE</kind>
    <capacity>1</capacity>
  </resource>
    

  <taskToImpl>
    <taskID>1001</taskID>
    <implID>SIGINT_CALL</implID>
    <duration>10</duration>
  </taskToImpl>
  <taskToImpl>
    <taskID>1002</taskID>
    <implID>CAOC_COORD</implID>
    <duration>10</duration>
  </taskToImpl>
  <taskToImpl>
    <taskID>1003</taskID>
    <implID>UAV_LOCATE</implID>
    <duration>10</duration>
  </taskToImpl>
  <taskToImpl>
    <taskID>1004</taskID>
    <implID>UAV_LOCK</implID>
    <duration>10</duration>
  </taskToImpl>
  <taskToImpl>
    <taskID>1005</taskID>
    <implID>UAV_FIND_NEIGH</implID>
    <duration>10</duration>
  </taskToImpl>
  <taskToImpl>
    <taskID>1006</taskID>
    <implID>UAV_EXAMINE</implID>
    <duration>10</duration>
  </taskToImpl>
  <taskToImpl>
    <taskID>1007</taskID>
    <implID>UAV_ARMED</implID>
    <duration>5</duration>
  </taskToImpl>
  <taskToImpl>
    <taskID>1013</taskID>
    <implID>CAOC_APPROVAL</implID>
    <duration>10</duration>
  </taskToImpl>
  <taskToImpl>
    <taskID>1008</taskID>
    <implID>UAV_FIRE</implID>
    <duration>2</duration>
  </taskToImpl>
  <taskToImpl>
    <taskID>1009</taskID>
    <implID>UAV_ASSESS</implID>
    <duration>10</duration>
  </taskToImpl>
  <taskToImpl>
    <taskID>1010</taskID>
    <implID>GROUND_PREPARE</implID>
    <duration>10</duration>
  </taskToImpl>
  <taskToImpl>
    <taskID>1011</taskID>
    <implID>CAOC_SET</implID>
    <duration>10</duration>
  </taskToImpl>
  <taskToImpl>
    <taskID>1012</taskID>
    <implID>GROUND_SEIZE</implID>
    <duration>10</duration>
  </taskToImpl>

  <implToResource>
    <implID>SIGINT_CALL</implID>
    <resourceID>Intel</resourceID>
    <utilization>1</utilization>
  </implToResource>
  <implToResource>
    <implID>CAOC_COORD</implID>
    <resourceID>Intel</resourceID>
    <utilization>1</utilization>
  </implToResource>
  <implToResource>
    <implID>UAV_LOCATE</implID>
    <resourceID>Vehicles</resourceID>
    <utilization>1</utilization>
  </implToResource>
  <implToResource>
    <implID>UAV_LOCK</implID>
    <resourceID>Vehicles</resourceID>
    <utilization>1</utilization>
  </implToResource>
  <implToResource>
    <implID>UAV_FIND_NEIGH</implID>
    <resourceID>Vehicles</resourceID>
    <utilization>1</utilization>
  </implToResource>
  <implToResource>
    <implID>UAV_EXAMINE</implID>
    <resourceID>Vehicles</resourceID>
    <utilization>1</utilization>
  </implToResource>
  <implToResource>
    <implID>UAV_ARMED</implID>
    <resourceID>Vehicles</resourceID>
    <utilization>1</utilization>
  </implToResource>
  <implToResource>
    <implID>CAOC_APPROVAL</implID>
    <resourceID>Intel</resourceID>
    <utilization>1</utilization>
  </implToResource>
  <implToResource>
    <implID>UAV_FIRE</implID>
    <resourceID>Vehicles</resourceID>
    <utilization>1</utilization>
  </implToResource>
  <implToResource>
    <implID>UAV_ASSESS</implID>
    <resourceID>Vehicles</resourceID>
    <utilization>1</utilization>
  </implToResource>
  <implToResource>
    <implID>CAOC_SET</implID>
    <resourceID>Intel</resourceID>
    <utilization>1</utilization>
  </implToResource>
  <implToResource>
    <implID>GROUND_PREPARE</implID>
    <resourceID>Troops</resourceID>
    <utilization>1</utilization>
  </implToResource>
  <implToResource>
    <implID>GROUND_SEIZE</implID>
    <resourceID>Troops</resourceID>
    <utilization>1</utilization>
  </implToResource>


</SA-POP:taskMap>