<?xml version="1.0" encoding="utf-8" ?>
<SA-POP:taskMap xmlns:SA-POP="http://www.vanderbilt.edu/SA-POP" xmlns:xsi="http://www.w3.org/2001/XMLSchema-instance"
  xsi:schemaLocation="http://www.vanderbilt.edu/SA-POP Task_Map.xsd" xmlns="http://www.vanderbilt.edu/SA-POP">
  <taskImpl>
    <implID>_ABFC1EAC-BA43-4F33-969C-72DF5F15310A1</implID>
    <param>
      <paramID></paramID>
      <kind></kind>
      <value></value>
    </param>
  </taskImpl>
  <taskImpl>
    <implID>_6F72C45B-C490-4D1F-B79B-744489E16C7E2</implID>
    <param>
      <paramID></paramID>
      <kind></kind>
      <value></value>
    </param>
  </taskImpl>
  <taskImpl>
    <implID>_8E619279-F191-495B-86D9-8813967D73EB3</implID>
    <param>
      <paramID></paramID>
      <kind></kind>
      <value></value>
    </param>
  </taskImpl>
  <taskImpl>
    <implID>_47EB0690-2A1B-42F6-AA60-B901814E884E4</implID>
    <param>
      <paramID></paramID>
      <kind></kind>
      <value></value>
    </param>
  </taskImpl>
  <taskImpl>
    <implID>_A622DD4F-F709-479E-AEC6-80680D6B543D5</implID>
    <param>
      <paramID></paramID>
      <kind></kind>
      <value></value>
    </param>
  </taskImpl>
  <taskImpl>
    <implID>_864725F9-CBB2-462E-85F2-CE44C668A39E6</implID>
    <param>
      <paramID></paramID>
      <kind></kind>
      <value></value>
    </param>
  </taskImpl>
  <taskImpl>
    <implID>_DB70C55B-3312-4279-9354-73B0DF98DAAA7</implID>
    <param>
      <paramID></paramID>
      <kind></kind>
      <value></value>
    </param>
  </taskImpl>
  <taskImpl>
    <implID>_7CB380A7-8BCD-44C5-8D12-63AD69D753BD8</implID>
    <param>
      <paramID></paramID>
      <kind></kind>
      <value></value>
    </param>
  </taskImpl>
  <taskImpl>
    <implID>_7CB380A7-8BCD-44C5-8D12-63AD69D753CE9</implID>
    <param>
      <paramID></paramID>
      <kind></kind>
      <value></value>
    </param>
  </taskImpl>
  <taskImpl>
    <implID>_7CB380A7-8BCD-44C5-8D12-63AD69D753C10</implID>
    <param>
      <paramID></paramID>
      <kind></kind>
      <value></value>
    </param>
  </taskImpl>
  <resource>
    <resourceID>MEMORY</resourceID>
    <kind>DISCRETE</kind>
    <capacity>15</capacity>
  </resource>
  <taskToImpl>
    <taskID>201</taskID>
    <implID>_ABFC1EAC-BA43-4F33-969C-72DF5F15310A1</implID>
    <duration>6</duration>
  </taskToImpl>
  <taskToImpl>
    <taskID>202</taskID>
    <implID>_ABFC1EAC-BA43-4F33-969C-72DF5F15310A1</implID>
    <duration>6</duration>
  </taskToImpl>
  <taskToImpl>
    <taskID>203</taskID>
    <implID>_ABFC1EAC-BA43-4F33-969C-72DF5F15310A1</implID>
    <duration>6</duration>
  </taskToImpl>
  <taskToImpl>
    <taskID>204</taskID>
    <implID>_ABFC1EAC-BA43-4F33-969C-72DF5F15310A1</implID>
    <duration>6</duration>
  </taskToImpl>
  <taskToImpl>
    <taskID>211</taskID>
    <implID>_6F72C45B-C490-4D1F-B79B-744489E16C7E2</implID>
    <duration>0</duration>
  </taskToImpl>
  <taskToImpl>
    <taskID>212</taskID>
    <implID>_6F72C45B-C490-4D1F-B79B-744489E16C7E2</implID>
    <duration>0</duration>
  </taskToImpl>
  <taskToImpl>
    <taskID>213</taskID>
    <implID>_6F72C45B-C490-4D1F-B79B-744489E16C7E2</implID>
    <duration>0</duration>
  </taskToImpl>
  <taskToImpl>
    <taskID>214</taskID>
    <implID>_6F72C45B-C490-4D1F-B79B-744489E16C7E2</implID>
    <duration>0</duration>
  </taskToImpl>
  <taskToImpl>
    <taskID>221</taskID>
    <implID>_8E619279-F191-495B-86D9-8813967D73EB3</implID>
    <duration>0</duration>
  </taskToImpl>
  <taskToImpl>
    <taskID>222</taskID>
    <implID>_8E619279-F191-495B-86D9-8813967D73EB3</implID>
    <duration>0</duration>
  </taskToImpl>
  <taskToImpl>
    <taskID>281</taskID>
    <implID>_47EB0690-2A1B-42F6-AA60-B901814E884E4</implID>
    <duration>0</duration>
  </taskToImpl>
  <taskToImpl>
    <taskID>282</taskID>
    <implID>_47EB0690-2A1B-42F6-AA60-B901814E884E4</implID>
    <duration>0</duration>
  </taskToImpl>
  <taskToImpl>
    <taskID>241</taskID>
    <implID>_A622DD4F-F709-479E-AEC6-80680D6B543D5</implID>
    <duration>0</duration>
  </taskToImpl>
  <taskToImpl>
    <taskID>241</taskID>
    <implID>_7CB380A7-8BCD-44C5-8D12-63AD69D753C10</implID>
    <duration>0</duration>
  </taskToImpl>
  <taskToImpl>
    <taskID>242</taskID>
    <implID>_A622DD4F-F709-479E-AEC6-80680D6B543D5</implID>
    <duration>0</duration>
  </taskToImpl>
  <taskToImpl>
    <taskID>231</taskID>
    <implID>_864725F9-CBB2-462E-85F2-CE44C668A39E6</implID>
    <duration>0</duration>
  </taskToImpl>
  <taskToImpl>
    <taskID>251</taskID>
    <implID>_DB70C55B-3312-4279-9354-73B0DF98DAAA7</implID>
    <duration>0</duration>
  </taskToImpl>
  <taskToImpl>
    <taskID>252</taskID>
    <implID>_DB70C55B-3312-4279-9354-73B0DF98DAAA7</implID>
    <duration>0</duration>
  </taskToImpl>
  <taskToImpl>
    <taskID>261</taskID>
    <implID>_7CB380A7-8BCD-44C5-8D12-63AD69D753BD8</implID>
    <duration>0</duration>
  </taskToImpl>
  <taskToImpl>
    <taskID>262</taskID>
    <implID>_7CB380A7-8BCD-44C5-8D12-63AD69D753BD8</implID>
    <duration>0</duration>
  </taskToImpl>
  <taskToImpl>
    <taskID>271</taskID>
    <implID>_7CB380A7-8BCD-44C5-8D12-63AD69D753CE9</implID>
    <duration>0</duration>
  </taskToImpl>
  <implToResource>
    <implID>_ABFC1EAC-BA43-4F33-969C-72DF5F15310A1</implID>
    <resourceID>MEMORY</resourceID>
    <utilization>1</utilization>
  </implToResource>
  <implToResource>
    <implID>_6F72C45B-C490-4D1F-B79B-744489E16C7E2</implID>
    <resourceID>MEMORY</resourceID>
    <utilization>3</utilization>
  </implToResource>
  <implToResource>
    <implID>_8E619279-F191-495B-86D9-8813967D73EB3</implID>
    <resourceID>MEMORY</resourceID>
    <utilization>1</utilization>
  </implToResource>
  <implToResource>
    <implID>_47EB0690-2A1B-42F6-AA60-B901814E884E4</implID>
    <resourceID>MEMORY</resourceID>
    <utilization>2</utilization>
  </implToResource>
  <implToResource>
    <implID>_A622DD4F-F709-479E-AEC6-80680D6B543D5</implID>
    <resourceID>MEMORY</resourceID>
    <utilization>6</utilization>
  </implToResource>
  <implToResource>
    <implID>_864725F9-CBB2-462E-85F2-CE44C668A39E6</implID>
    <resourceID>MEMORY</resourceID>
    <utilization>3</utilization>
  </implToResource>
  <implToResource>
    <implID>_DB70C55B-3312-4279-9354-73B0DF98DAAA7</implID>
    <resourceID>MEMORY</resourceID>
    <utilization>4</utilization>
  </implToResource>
  <implToResource>
    <implID>_7CB380A7-8BCD-44C5-8D12-63AD69D753BD8</implID>
    <resourceID>MEMORY</resourceID>
    <utilization>1</utilization>
  </implToResource>
  <implToResource>
    <implID>_7CB380A7-8BCD-44C5-8D12-63AD69D753CE9</implID>
    <resourceID>MEMORY</resourceID>
    <utilization>2</utilization>
  </implToResource>
  <implToResource>
    <implID>_7CB380A7-8BCD-44C5-8D12-63AD69D753C10</implID>
    <resourceID>MEMORY</resourceID>
    <utilization>2</utilization>
  </implToResource>
</SA-POP:taskMap>